{
  "schema_version": "2.0-rc1",
  "issue_id": "2026-W34",
  "batch_id": "batch-001",
  "basis": {
    "package_sha256": "4e53370d1f7f4b822698331c2a1a81bdf1cfc7e59d9600f87469932e495e6e79",
    "batch_sha256": "6ff2bf503d59d866d0840b1d90fcb1f151f6e638ebd7f8faa142dea2f0ff3228",
    "profile_sha256": "a6e3eb3006dde95da008876486cbfc7fdce75f507f7efcd6b0fcaba5e154b21a",
    "state_sha256": "2eaa0dbb1a6bdee745b2fb836a9fc6ad70c46bded86b51faf313cf5e3e512768",
    "prompt_sha256": "3e45900ead73688eab8734036e6e476c1ec4f1a7ce38da42d5ca52a68ef0a862",
    "result_contract_sha256": "a05b65b41efbcaf654df5c3c5944254a76d93d8a28cab961f2c06f6d580da5a2"
  },
  "decisions": [
    {
      "discovery_id": "w34-event-c001",
      "decision": "KEEP",
      "reason": "GLM-5.3 flagship release is materially relevant to W34 on current relevance and/or technical significance; proceed to Evidence verification without treating discovery claims as established evidence.",
      "scope_tags": [
        "foundation-models",
        "agents"
      ],
      "duplicate_group": null,
      "verification_targets": [
        "Release confirmed; exact Aug 14 time vs 22:00Z boundary still unresolved. Keep W34 adoption/free-access/coding-agent delta regardless."
      ],
      "confidence": "medium"
    },
    {
      "discovery_id": "w34-event-c002",
      "decision": "KEEP",
      "reason": "Claude text watermark is materially relevant to W34 on current relevance and/or technical significance; proceed to Evidence verification without treating discovery claims as established evidence.",
      "scope_tags": [
        "safety",
        "provenance",
        "policy"
      ],
      "duplicate_group": null,
      "verification_targets": [
        "Future Claude models use token-choice watermarking for EU AI Act compliance. Exact page time vs W34 start unresolved; ordinary-window X discussion exists."
      ],
      "confidence": "medium"
    },
    {
      "discovery_id": "w34-event-c003",
      "decision": "KEEP",
      "reason": "OpenRouter joins Stripe is materially relevant to W34 on current relevance and/or technical significance; proceed to Evidence verification without treating discovery claims as established evidence.",
      "scope_tags": [
        "inference",
        "routing",
        "business"
      ],
      "duplicate_group": null,
      "verification_targets": [
        "Confirmed transaction/integration event; model gateway scale and routing economics are technically relevant."
      ],
      "confidence": "high"
    },
    {
      "discovery_id": "w34-event-c004",
      "decision": "KEEP",
      "reason": "ChatGPT for Teens is materially relevant to W34 on current relevance and/or technical significance; proceed to Evidence verification without treating discovery claims as established evidence.",
      "scope_tags": [
        "product",
        "safety"
      ],
      "duplicate_group": null,
      "verification_targets": [
        "Distinct teen experience with automatic age routing and stronger safety controls."
      ],
      "confidence": "high"
    },
    {
      "discovery_id": "w34-event-c005",
      "decision": "KEEP",
      "reason": "OpenAI cyber-critical capability pacing is materially relevant to W34 on current relevance and/or technical significance; proceed to Evidence verification without treating discovery claims as established evidence.",
      "scope_tags": [
        "safety",
        "security",
        "frontier-governance"
      ],
      "duplicate_group": null,
      "verification_targets": [
        "Astra preliminary Critical cyber threshold evidence plus stronger containment/monitoring/alignment and development pacing."
      ],
      "confidence": "high"
    },
    {
      "discovery_id": "w34-event-c006",
      "decision": "KEEP",
      "reason": "Ray CVE-2025-62593 added to CISA KEV is materially relevant to W34 on current relevance and/or technical significance; proceed to Evidence verification without treating discovery claims as established evidence.",
      "scope_tags": [
        "safety",
        "security",
        "systems"
      ],
      "duplicate_group": null,
      "verification_targets": [
        "W34 exploitation/KEV delta is distinct from 2025 vulnerability disclosure."
      ],
      "confidence": "high"
    },
    {
      "discovery_id": "w34-event-c007",
      "decision": "INSPECT",
      "reason": "Alipay full-stack agentic commerce platform may be materially relevant, but source identity, chronology, authority, or claim scope remains insufficiently resolved for a direct KEEP/DROP decision.",
      "scope_tags": [
        "agents",
        "mcp",
        "commerce"
      ],
      "duplicate_group": null,
      "verification_targets": [
        "Agent-ready Skills/MCP conversion, AHA interoperability, payments/identity/risk/fulfillment. Seek direct Ant/Alipay release for Evidence."
      ],
      "confidence": "medium"
    },
    {
      "discovery_id": "w34-event-c008",
      "decision": "KEEP",
      "reason": "OpenAI Zero Data Retention + Private Safety Processing is materially relevant to W34 on current relevance and/or technical significance; proceed to Evidence verification without treating discovery claims as established evidence.",
      "scope_tags": [
        "safety",
        "privacy",
        "serving"
      ],
      "duplicate_group": null,
      "verification_targets": [
        "Cross-interaction safety pattern detection designed to remain compatible with ZDR."
      ],
      "confidence": "high"
    },
    {
      "discovery_id": "w34-event-c009",
      "decision": "KEEP",
      "reason": "Claude protein design / analytical chemistry results is materially relevant to W34 on current relevance and/or technical significance; proceed to Evidence verification without treating discovery claims as established evidence.",
      "scope_tags": [
        "research",
        "science"
      ],
      "duplicate_group": null,
      "verification_targets": [
        "Primary research result; maker-reported experimental claims require careful framing."
      ],
      "confidence": "high"
    },
    {
      "discovery_id": "w34-event-c010",
      "decision": "KEEP",
      "reason": "Amazon Bedrock AgentCore Payments GA is materially relevant to W34 on current relevance and/or technical significance; proceed to Evidence verification without treating discovery claims as established evidence.",
      "scope_tags": [
        "agents",
        "mcp",
        "payments"
      ],
      "duplicate_group": null,
      "verification_targets": [
        "Autonomous paid API/MCP/content transactions with guardrails and observability."
      ],
      "confidence": "high"
    },
    {
      "discovery_id": "w34-event-c011",
      "decision": "KEEP",
      "reason": "Claude Platform Computer Use + Skills API + Files API GA is materially relevant to W34 on current relevance and/or technical significance; proceed to Evidence verification without treating discovery claims as established evidence.",
      "scope_tags": [
        "agents",
        "computer-use"
      ],
      "duplicate_group": null,
      "verification_targets": [
        "Computer use, Skills API, Files API generally available; browser use tool added."
      ],
      "confidence": "high"
    },
    {
      "discovery_id": "w34-event-c012",
      "decision": "KEEP",
      "reason": "Slack Code channels for coding agents is materially relevant to W34 on current relevance and/or technical significance; proceed to Evidence verification without treating discovery claims as established evidence.",
      "scope_tags": [
        "coding-agents",
        "collaboration"
      ],
      "duplicate_group": null,
      "verification_targets": [
        "Moves agent coding work from private sessions into collaborative code channels."
      ],
      "confidence": "high"
    },
    {
      "discovery_id": "w34-event-c013",
      "decision": "KEEP",
      "reason": "LFM2.5-DSpark speculative decoding checkpoints is materially relevant to W34 on current relevance and/or technical significance; proceed to Evidence verification without treating discovery claims as established evidence.",
      "scope_tags": [
        "inference",
        "local-ai"
      ],
      "duplicate_group": "lfm2.5-inference",
      "verification_targets": [
        "Public draft checkpoints for three LFM2.5 models; vendor-reported throughput gains."
      ],
      "confidence": "high"
    },
    {
      "discovery_id": "w34-event-c014",
      "decision": "MAYBE",
      "reason": "GPT-Image-2 transparent background preview has a plausible W34 delta, but its relative technical/editorial significance is not yet strong enough for unconditional Evidence priority.",
      "scope_tags": [
        "image-generation",
        "api"
      ],
      "duplicate_group": null,
      "verification_targets": [
        "Clear API capability delta; community reports include edge-quality caveats."
      ],
      "confidence": "medium"
    },
    {
      "discovery_id": "w34-event-c015",
      "decision": "KEEP",
      "reason": "Tencent UI-Mate-27B open-weight GUI agent is materially relevant to W34 on current relevance and/or technical significance; proceed to Evidence verification without treating discovery claims as established evidence.",
      "scope_tags": [
        "agents",
        "multimodal",
        "open-weight"
      ],
      "duplicate_group": null,
      "verification_targets": [
        "27B GUI agent for long-horizon desktop tasks; benchmark numbers maker-reported."
      ],
      "confidence": "high"
    },
    {
      "discovery_id": "w34-event-c016",
      "decision": "INSPECT",
      "reason": "X Ads MCP launch may be materially relevant, but source identity, chronology, authority, or claim scope remains insufficiently resolved for a direct KEEP/DROP decision.",
      "scope_tags": [
        "agents",
        "mcp",
        "advertising"
      ],
      "duplicate_group": null,